{
  "opendoc": 1,
  "doc": "plan.md",
  "docHash": "sha256:477285d8e3718c2fa586d22bf14594d810dfd76ccb7a2b83c6250ad8aeba7d8f",
  "participants": [
    {
      "name": "fzhan",
      "kind": "human"
    },
    {
      "name": "claude",
      "kind": "agent"
    }
  ],
  "threads": [
    {
      "id": "t_8f3k2a9x",
      "anchor": {
        "exact": "ship all six features",
        "prefix": "Q4 Launch Plan\nWe plan to ",
        "suffix": " in week one, then gather feedba",
        "start": 26
      },
      "detached": false,
      "status": "open",
      "resolvedBy": null,
      "resolvedAt": null,
      "working": {
        "by": "claude",
        "since": "2026-10-14T18:20:01Z"
      },
      "messages": [
        {
          "id": "m_q81xk2pd",
          "author": {
            "name": "fzhan",
            "kind": "human"
          },
          "body": "@claude is six realistic for week one?",
          "mentions": [
            "claude"
          ],
          "createdAt": "2026-10-14T18:20:00Z"
        }
      ]
    },
    {
      "id": "t_r4pz0c1m",
      "anchor": {
        "exact": "cannot handle the extra load",
        "prefix": "n risk is that the sync service ",
        "suffix": ".",
        "start": 175
      },
      "detached": false,
      "status": "resolved",
      "resolvedBy": "fzhan",
      "resolvedAt": "2026-10-14T18:31:12Z",
      "working": null,
      "messages": [
        {
          "id": "m_a7b2c9d1",
          "author": {
            "name": "claude",
            "kind": "agent"
          },
          "body": "Can we quantify the expected load?",
          "mentions": [],
          "createdAt": "2026-10-14T18:25:40Z"
        },
        {
          "id": "m_e5f6g7h8",
          "author": {
            "name": "fzhan",
            "kind": "human"
          },
          "body": "Roughly 3x peak; added to the capacity doc.",
          "mentions": [],
          "createdAt": "2026-10-14T18:31:10Z"
        }
      ]
    },
    {
      "id": "t_doclvl01",
      "anchor": null,
      "detached": false,
      "status": "open",
      "resolvedBy": null,
      "resolvedAt": null,
      "working": null,
      "messages": [
        {
          "id": "m_k3l4m5n6",
          "author": {
            "name": "fzhan",
            "kind": "human"
          },
          "body": "Overall: tighten the timeline section before Friday.",
          "mentions": [],
          "createdAt": "2026-10-14T18:40:00Z"
        }
      ]
    }
  ]
}
